{
  "course_id": "frm-demo",
  "artifact_type": "blueprint",
  "produced_by_step": "blueprint",
  "schema_version": "0.2",
  "status": "approved",
  "revision": 0,
  "revision_note": "Phase 1 selects all nine benchmark assets for m1_s1; later courses may select any subset.",
  "inputs": ["course_model"],
  "updated_at": "2026-06-30T00:00:00+00:00",
  "body": {
    "course_defaults": {
      "depth_budget": {
        "level": "intermediate",
        "target_learning_minutes": 30,
        "target_word_range": {
          "minimum": 1600,
          "target": 2200,
          "maximum": 2800
        },
        "required_concept_ids": [],
        "required_example_count": 4,
        "case_depth": "detailed",
        "assessment_complexity": "analysis",
        "expansion_policy": "targeted_by_coverage_gap"
      },
      "default_asset_types": [
        "learning_objectives",
        "course_content",
        "summary",
        "assessment"
      ],
      "source_routing_policy": "Route only sources approved for the subtopic; do not route rejected, proposed, unavailable, or contentless sources."
    },
    "subtopic_plans": [
      {
        "subtopic_id": "m1_s1",
        "depth_budget": {
          "level": "intermediate",
          "target_learning_minutes": 30,
          "target_word_range": {
            "minimum": 1600,
            "target": 2200,
            "maximum": 2800
          },
          "required_concept_ids": ["c1", "c2", "c3", "c4", "c5", "c6", "c7", "c8"],
          "required_example_count": 4,
          "case_depth": "detailed",
          "assessment_complexity": "analysis",
          "expansion_policy": "targeted_by_coverage_gap"
        },
        "asset_plan": [
          {
            "id": "m1_s1_lo",
            "asset_type": "learning_objectives",
            "title": "Learning Objectives",
            "format": "docx",
            "selection_status": "selected",
            "purpose": "State measurable outcomes aligned to the generated lesson.",
            "source_ids": ["g1", "g2", "g3", "g4", "g5"]
          },
          {
            "id": "m1_s1_cc",
            "asset_type": "course_content",
            "title": "Nature of Financial Risk",
            "format": "pptx",
            "selection_status": "selected",
            "purpose": "Teach the approved coverage requirements at the configured depth.",
            "source_ids": ["g1", "g2", "g3", "g4", "g5"]
          },
          {
            "id": "m1_s1_summary",
            "asset_type": "summary",
            "title": "Summary",
            "format": "docx",
            "selection_status": "selected",
            "purpose": "Reinforce the lesson's core ideas without adding new claims.",
            "source_ids": ["g1", "g2", "g3", "g4", "g5"]
          },
          {
            "id": "m1_s1_case",
            "asset_type": "case_study",
            "title": "The Lehman Brothers Collapse",
            "format": "pptx",
            "selection_status": "selected",
            "purpose": "Apply layered-risk concepts to a grounded real-world case.",
            "source_ids": ["g5"]
          },
          {
            "id": "m1_s1_person",
            "asset_type": "important_person",
            "title": "Frank Knight — The Foundation of Risk Theory",
            "format": "pptx",
            "selection_status": "selected",
            "purpose": "Connect the risk-versus-uncertainty distinction to its intellectual origin.",
            "source_ids": ["g1"]
          },
          {
            "id": "m1_s1_dyk",
            "asset_type": "did_you_know",
            "title": "The CRO Role Barely Existed Before the 1990s",
            "format": "pptx",
            "selection_status": "selected",
            "purpose": "Add a concise, grounded historical insight about integrated risk oversight.",
            "source_ids": ["g6"]
          },
          {
            "id": "m1_s1_assess",
            "asset_type": "assessment",
            "title": "Assessment",
            "format": "pptx",
            "selection_status": "selected",
            "purpose": "Test understanding and analytical application with a teacher solution.",
            "source_ids": ["g1", "g2", "g3", "g4", "g5"]
          },
          {
            "id": "m1_s1_activities",
            "asset_type": "activities",
            "title": "Activities",
            "format": "docx",
            "selection_status": "selected",
            "purpose": "Provide participatory practice aligned to the lesson.",
            "source_ids": ["g1", "g2", "g3", "g4", "g5"]
          },
          {
            "id": "m1_s1_resources",
            "asset_type": "resources",
            "title": "Additional Resources",
            "format": "docx",
            "selection_status": "selected",
            "purpose": "Offer vetted paths for further study.",
            "source_ids": ["g1", "g2", "g3", "g4", "g5", "g6"]
          }
        ],
        "source_routing_notes": "All selected benchmark assets route only the approved m1_s1 source ids.",
        "anchor_asset_waiver_confirmed": false
      }
    ],
    "decision_log": [
      {
        "id": "bd1",
        "scope": "m1_s1",
        "decision": "selected_all_phase1_benchmark_assets",
        "rationale": "The Phase 1 benchmark required all nine asset types for the first subtopic."
      }
    ]
  }
}
